{
  "$schema": "https://json-schema.org/draft/2020-12/schema",
  "$id": "https://github.com/MightyM-ouse/eMAS/config/report-mappings/report-template-map.schema.json",
  "title": "eMAS Report Template Map v3.2",
  "type": "object",
  "additionalProperties": false,
  "required": [
    "mappingId",
    "mappingVersion",
    "phaseCode",
    "phaseName",
    "template",
    "requiredSheetOrder",
    "protectedTables",
    "tableMappings"
  ],
  "properties": {
    "mappingId": {
      "type": "string"
    },
    "mappingVersion": {
      "type": "string"
    },
    "phaseCode": {
      "enum": [
        "PRE_SALES",
        "PRE_MIGRATION",
        "POST_MIGRATION"
      ]
    },
    "phaseName": {
      "type": "string"
    },
    "description": {
      "type": "string"
    },
    "resultSchemaPath": {
      "type": "string"
    },
    "template": {
      "type": "object",
      "required": [
        "templateId",
        "templateName",
        "templateVersion",
        "templateFilePath",
        "templateControlTable"
      ],
      "additionalProperties": true
    },
    "requiredSheetOrder": {
      "type": "array",
      "items": {
        "type": "string"
      },
      "minItems": 1,
      "uniqueItems": true
    },
    "protectedTables": {
      "type": "array",
      "items": {
        "type": "object",
        "additionalProperties": true
      }
    },
    "tableMappings": {
      "type": "array",
      "minItems": 1,
      "items": {
        "type": "object",
        "required": [
          "sheetName",
          "tableName",
          "sourceCollection",
          "writeMode",
          "headerRow",
          "firstDataRow",
          "columns"
        ],
        "additionalProperties": true
      }
    }
  }
}
