{
  "mappingId": "EMAS-MAP-POSTMIGRATION",
  "mappingVersion": "2.0.0",
  "phaseCode": "POST_MIGRATION",
  "phaseName": "Post-Migration Verification",
  "description": "Technical result-to-workbook binding for the approved report redesign v3.2. Contains no business rules, RAG logic, readiness logic, reconciliation logic or effort logic.",
  "template": {
    "templateId": "EMAS-TPL-POSTMIGRATION",
    "templateName": "eMAS_PostMigration_Template.xlsx",
    "templateVersion": "1.2.0",
    "templateFilePath": "templates/controlled/post-migration/eMAS_PostMigration_Template.xlsx",
    "templateControlTable": "tblPostMigrationTemplateControl"
  },
  "resultSchemaPath": "config/result-schemas/report-redesign-v3.2/post-migration.result.schema.json",
  "requiredSheetOrder": [
    "01_Executive_Summary",
    "02_Verification_Scope",
    "03_Overall_Reconciliation",
    "04_Dossier_Before_&_After",
    "05_Sequence_Before_&_After",
    "06_File_Type_&_Size_Comparison",
    "07_Database_Dossier_Inventory",
    "08_Import_Evidence_Review",
    "09_Discrepancies_&_Actions",
    "10_Accepted_Exceptions",
    "11_Assumptions_&_Limits",
    "12_Review_&_Execution",
    "Import Report Detail",
    "Post Import Verification",
    "Database Dossier Extract"
  ],
  "protectedTables": [
    {
      "sheetName": "12_Review_&_Execution",
      "tableName": "tblPostMigrationTemplateControl",
      "protection": "readOnly",
      "preserveHeadersExactly": false,
      "reason": "Release-managed control metadata."
    },
    {
      "sheetName": "Import Report Detail",
      "tableName": "tblRawImportReportDetail",
      "protection": "appendOnly",
      "preserveHeadersExactly": true,
      "reason": "Raw evidence rows and literal headers are append-only and preserved exactly."
    },
    {
      "sheetName": "Post Import Verification",
      "tableName": "tblRawPostImportVerification",
      "protection": "appendOnly",
      "preserveHeadersExactly": true,
      "reason": "Raw evidence rows and literal headers are append-only and preserved exactly."
    },
    {
      "sheetName": "Database Dossier Extract",
      "tableName": "tblRawDatabaseDossierExtract",
      "protection": "appendOnly",
      "preserveHeadersExactly": true,
      "reason": "Raw evidence rows and literal headers are append-only and preserved exactly."
    }
  ],
  "tableMappings": [
    {
      "sheetName": "01_Executive_Summary",
      "tableName": "tblPostMigrationExecutiveSummary",
      "sourceCollection": "summaryMetrics",
      "writeMode": "appendRows",
      "headerRow": 5,
      "firstDataRow": 6,
      "startColumn": 1,
      "rowCapacity": {
        "maxPreProvisionedRows": 1000,
        "rowInsertionBehavior": "appendWithinPreProvisionedRange",
        "followingTable": null
      },
      "columns": [
        {
          "targetColumn": "Section",
          "sourceField": "section",
          "required": false,
          "dataType": "String",
          "controlledValueList": null,
          "format": null
        },
        {
          "targetColumn": "Metric",
          "sourceField": "metric",
          "required": false,
          "dataType": "String",
          "controlledValueList": null,
          "format": null
        },
        {
          "targetColumn": "Value",
          "sourceField": "value",
          "required": false,
          "dataType": "String",
          "controlledValueList": null,
          "format": null
        },
        {
          "targetColumn": "EvaluationStatus",
          "sourceField": "evaluationStatus",
          "required": false,
          "dataType": "String",
          "controlledValueList": "EvaluationStatus",
          "format": null
        },
        {
          "targetColumn": "RAG",
          "sourceField": "rAG",
          "required": false,
          "dataType": "String",
          "controlledValueList": "RAG",
          "format": null
        },
        {
          "targetColumn": "Confidence",
          "sourceField": "confidence",
          "required": false,
          "dataType": "String",
          "controlledValueList": "Confidence",
          "format": null
        },
        {
          "targetColumn": "ValueSource",
          "sourceField": "valueSource",
          "required": false,
          "dataType": "String",
          "controlledValueList": "ValueSource",
          "format": null
        },
        {
          "targetColumn": "ReviewRequired",
          "sourceField": "reviewRequired",
          "required": false,
          "dataType": "String",
          "controlledValueList": "YesNo",
          "format": null
        },
        {
          "targetColumn": "Description",
          "sourceField": "description",
          "required": false,
          "dataType": "LongText",
          "controlledValueList": null,
          "format": null
        }
      ]
    },
    {
      "sheetName": "01_Executive_Summary",
      "tableName": "tblPostMigrationCriticalDiscrepancies",
      "sourceCollection": "criticalDiscrepancies",
      "writeMode": "appendRows",
      "headerRow": 30,
      "firstDataRow": 31,
      "startColumn": 1,
      "rowCapacity": {
        "maxPreProvisionedRows": 1000,
        "rowInsertionBehavior": "appendWithinPreProvisionedRange",
        "followingTable": null
      },
      "columns": [
        {
          "targetColumn": "Priority",
          "sourceField": "priority",
          "required": false,
          "dataType": "String",
          "controlledValueList": "Priority",
          "format": null
        },
        {
          "targetColumn": "DiscrepancyId",
          "sourceField": "discrepancyId",
          "required": false,
          "dataType": "Identifier",
          "controlledValueList": null,
          "format": null
        },
        {
          "targetColumn": "Area",
          "sourceField": "area",
          "required": false,
          "dataType": "String",
          "controlledValueList": null,
          "format": null
        },
        {
          "targetColumn": "DossierName",
          "sourceField": "dossierName",
          "required": false,
          "dataType": "String",
          "controlledValueList": null,
          "format": null
        },
        {
          "targetColumn": "SequenceId",
          "sourceField": "sequenceId",
          "required": false,
          "dataType": "Identifier",
          "controlledValueList": null,
          "format": null
        },
        {
          "targetColumn": "Difference",
          "sourceField": "difference",
          "required": false,
          "dataType": "Number",
          "controlledValueList": null,
          "format": null
        },
        {
          "targetColumn": "RAG",
          "sourceField": "rAG",
          "required": false,
          "dataType": "String",
          "controlledValueList": "RAG",
          "format": null
        },
        {
          "targetColumn": "PrimaryRAGReason",
          "sourceField": "primaryRAGReason",
          "required": false,
          "dataType": "LongText",
          "controlledValueList": null,
          "format": null
        },
        {
          "targetColumn": "AcceptedException",
          "sourceField": "acceptedException",
          "required": false,
          "dataType": "String",
          "controlledValueList": "YesNo",
          "format": null
        },
        {
          "targetColumn": "RequiredAction",
          "sourceField": "requiredAction",
          "required": false,
          "dataType": "LongText",
          "controlledValueList": null,
          "format": null
        },
        {
          "targetColumn": "Owner",
          "sourceField": "owner",
          "required": false,
          "dataType": "String",
          "controlledValueList": null,
          "format": null
        },
        {
          "targetColumn": "TargetDate",
          "sourceField": "targetDate",
          "required": false,
          "dataType": "DateTime",
          "controlledValueList": null,
          "format": null
        },
        {
          "targetColumn": "ReviewStatus",
          "sourceField": "reviewStatus",
          "required": false,
          "dataType": "String",
          "controlledValueList": null,
          "format": null
        },
        {
          "targetColumn": "ReviewerNote",
          "sourceField": "reviewerNote",
          "required": false,
          "dataType": "LongText",
          "controlledValueList": null,
          "format": null
        }
      ]
    },
    {
      "sheetName": "02_Verification_Scope",
      "tableName": "tblPostMigrationVerificationScope",
      "sourceCollection": "verificationScope",
      "writeMode": "appendRows",
      "headerRow": 5,
      "firstDataRow": 6,
      "startColumn": 1,
      "rowCapacity": {
        "maxPreProvisionedRows": 1000,
        "rowInsertionBehavior": "appendWithinPreProvisionedRange",
        "followingTable": null
      },
      "columns": [
        {
          "targetColumn": "ScopeItemId",
          "sourceField": "scopeItemId",
          "required": false,
          "dataType": "Identifier",
          "controlledValueList": null,
          "format": null
        },
        {
          "targetColumn": "ScopeArea",
          "sourceField": "scopeArea",
          "required": false,
          "dataType": "String",
          "controlledValueList": null,
          "format": null
        },
        {
          "targetColumn": "EvidenceType",
          "sourceField": "evidenceType",
          "required": false,
          "dataType": "String",
          "controlledValueList": null,
          "format": null
        },
        {
          "targetColumn": "EvidenceVersion",
          "sourceField": "evidenceVersion",
          "required": false,
          "dataType": "String",
          "controlledValueList": null,
          "format": null
        },
        {
          "targetColumn": "EvidenceGeneratedAt",
          "sourceField": "evidenceGeneratedAt",